{
  "schemaVersion": 1,
  "protocol": "migration-guard.batch-update-l4c-scenario-package/v1",
  "status": "review-required",
  "realEvidenceEligible": false,
  "projectId": "zboss-batch-update-with-progress",
  "projectHash": "c31120bc701b3bd350a8ab9af4d543a25610a9923a2601b5298dc71ae5feebcc",
  "runtimeContractHash": "6457fbc0bf6728b0ba03115cc3fb2b920f22cd128d27b8e04157a21336322902",
  "sourceIdentity": {
    "revision": "a95e4cb51ceb62cc07602fe02c3cbb3e45f271ee",
    "dirty": true,
    "dirtyFingerprint": "bffb6682d768b19e32dacea82f5870cfd0acbf74b06051dbbf5da56511df2167",
    "identity": "a95e4cb51ceb62cc07602fe02c3cbb3e45f271ee+dirty:bffb6682d768"
  },
  "promotionWave": "sh3c-remaining-wave",
  "entrypointId": "post-zboss-data-view-dynamic-engine-use-engine-use-batch-page-batchUpdateWithProgress",
  "scenarioId": "entrypoint-parity",
  "category": "compatibility",
  "requiredDimensions": [
    "http",
    "context",
    "decisions",
    "effects",
    "state",
    "events",
    "failures"
  ],
  "decisionIds": [],
  "sourceDraft": {
    "path": "fixtures/java-runtime-drafts/post-zboss-data-view-dynamic-engine-use-engine-use-batch-page-batchUpdateWithProgress/entrypoint-parity/fixture.draft.json",
    "sha256": "6b39dac09959c46aca916d412f7b372fa8c01f11783d41dab00c36b7eab3dcf3"
  },
  "stateProfile": {
    "path": "evidence/runtime/l4c/java-state-profile.template.json",
    "sha256": "cab45568032446da26aaae696c083c6ef61f17ccdb58377091c5e8c09501ca6f",
    "status": "template",
    "applicableScenarios": [
      "primary-success",
      "validation-failure",
      "batch-partial-failure",
      "dependency-failure",
      "concurrent-write"
    ]
  },
  "collectors": {
    "events": {
      "path": "fixtures/java-runtime-drafts/post-zboss-data-view-dynamic-engine-use-engine-use-batch-page-batchUpdateWithProgress/entrypoint-parity/collectors/events.draft.json",
      "sha256": "f93fd2f0520e3b5022c07c52855de1f2c44c9dac27d35d9d7c95fcae9c94595e",
      "status": "draft",
      "reviewFindings": [
        "STATUS-NOT-READY",
        "WEBSOCKET-CAPTURE-NOT-CONFIRMED"
      ]
    },
    "mysql": {
      "path": "fixtures/java-runtime-drafts/post-zboss-data-view-dynamic-engine-use-engine-use-batch-page-batchUpdateWithProgress/entrypoint-parity/collectors/mysql.draft.json",
      "sha256": "4b213cba2e1345a9ba201c7466614c931ae61af91b23410b34872c13c068cbe1",
      "status": "draft",
      "reviewFindings": [
        "STATUS-NOT-READY",
        "PLACEHOLDER-PROBE"
      ]
    },
    "redis": {
      "path": "fixtures/java-runtime-drafts/post-zboss-data-view-dynamic-engine-use-engine-use-batch-page-batchUpdateWithProgress/entrypoint-parity/collectors/redis.draft.json",
      "sha256": "f5953888bc6bca7a954a08f4959211cf618e65755e77af32a7f4fb060a7109c8",
      "status": "draft",
      "reviewFindings": [
        "STATUS-NOT-READY",
        "PLACEHOLDER-PROBE",
        "JAVA-PROGRESS-IS-NOT-REDIS-BACKED"
      ]
    }
  },
  "requestPlan": {
    "status": "review-required",
    "placeholderPaths": [
      "$.body.batchPkFieldValue",
      "$.body.clientSessionId",
      "$.body.domain",
      "$.body.horizontalId",
      "$.body.interId",
      "$.body.operationKind",
      "$.body.operationLabel",
      "$.body.pageId",
      "$.body.panelId",
      "$.body.reqId",
      "$.body.usePageId",
      "$.headers.x-tenant-id"
    ],
    "environmentBindings": [
      {
        "path": "request.headers.authorization",
        "environment": "MG_JAVA_TOKEN"
      }
    ]
  },
  "seedPlan": {
    "status": "review-required",
    "plannedRows": 1,
    "java": {
      "status": "seed-required",
      "resourceRole": "projection",
      "binding": "scenario.seedProfiles.source"
    },
    "rust": {
      "status": "adapter-required",
      "resourceRole": "projection",
      "binding": "scenario.seedProfiles.target"
    }
  },
  "componentPreparation": {
    "status": "review-required",
    "path": "evidence/runtime/l4c/scenario-preparation/remaining-wave/components/entrypoint-parity.json",
    "sha256": "bd462038e97f052aec9c1025899988f09847df6854b86de490e204c4f0be067f",
    "seedCandidates": {
      "java": {
        "path": "evidence/runtime/l4c/scenario-preparation/remaining-wave/seeds/entrypoint-parity.java-seed.template.json",
        "sha256": "1ab469768d92726aa58b282c89de8088c5418ff594850534fcabfa12623353ed",
        "status": "review-required"
      },
      "rust": {
        "path": "evidence/runtime/l4c/scenario-preparation/remaining-wave/seeds/entrypoint-parity.rust-seed.adapter-template.json",
        "sha256": "510b2d55ef3d532806cf2258c1818d695d8a3cc0d30429bd5bf5d00f16095517",
        "status": "review-required"
      }
    },
    "collectorCandidates": {
      "events": {
        "path": "evidence/runtime/l4c/scenario-preparation/remaining-wave/collectors/entrypoint-parity.events.template.json",
        "sha256": "9083d25579bca9fa986aaae14ca3f8e77f74fd841a805072c27c370923e14cbd",
        "status": "review-required"
      },
      "mysql": {
        "path": "evidence/runtime/l4c/scenario-preparation/remaining-wave/collectors/entrypoint-parity.mysql.template.json",
        "sha256": "ae4885b6b71fe202f675618ab9429936d46312398326dca58d58e3492da3292e",
        "status": "review-required"
      },
      "redis": {
        "path": "evidence/runtime/l4c/scenario-preparation/remaining-wave/collectors/entrypoint-parity.redis.template.json",
        "sha256": "71970ed3a8c5cb50a8e6a1c862aa8111e0963763e4bc101274ad3dfbe121307c",
        "status": "review-required"
      }
    },
    "binding": {
      "path": "evidence/runtime/l4c/scenario-preparation/remaining-wave/binding-preparation.json",
      "status": "review-required",
      "scenarioBindingHash": "f107a2c098ca29f08b1a49e0713c379f26a9c2a6b57f18548478141d657108ab"
    }
  },
  "expectedObservation": {
    "status": "review-required",
    "dimensions": [
      "http",
      "context",
      "decisions",
      "effects",
      "state",
      "events",
      "failures"
    ],
    "invariants": [
      "complete-canonical-observation",
      "source-target-semantic-comparison",
      "marker-bound-cleanup-zero"
    ]
  },
  "semanticIntent": {
    "intent": "remaining-wave-entrypoint-parity-contract",
    "contractExpectations": {
      "batch": {
        "requireUndoCorrespondence": false,
        "requireProgressTerminal": true,
        "requireSharedLock": false,
        "requireChunkIdempotency": false,
        "requireTransactionTerminalOrdering": true,
        "requireRowLimitContract": false,
        "requireCompleteRowClassification": true,
        "requireReaderWriterLease": false,
        "requireUndoDurability": false,
        "requireProgressTerminalIdentity": false
      }
    }
  },
  "formalPromotion": {
    "command": "migration-guard migrate runtime-fixture-promote --case-dir cases/zboss-batch-update-with-progress --entrypoint post-zboss-data-view-dynamic-engine-use-engine-use-batch-page-batchUpdateWithProgress --scenario entrypoint-parity --reviewed-by <reviewer>",
    "allowedOnlyWhenBlockersEmpty": true,
    "status": "pending"
  },
  "blockers": [
    "MG-SH3C-COLLECTOR-REVIEW:events:STATUS-NOT-READY",
    "MG-SH3C-COLLECTOR-REVIEW:events:WEBSOCKET-CAPTURE-NOT-CONFIRMED",
    "MG-SH3C-COLLECTOR-REVIEW:mysql:PLACEHOLDER-PROBE",
    "MG-SH3C-COLLECTOR-REVIEW:mysql:STATUS-NOT-READY",
    "MG-SH3C-COLLECTOR-REVIEW:redis:JAVA-PROGRESS-IS-NOT-REDIS-BACKED",
    "MG-SH3C-COLLECTOR-REVIEW:redis:PLACEHOLDER-PROBE",
    "MG-SH3C-COLLECTOR-REVIEW:redis:STATUS-NOT-READY",
    "MG-SH3C-FIXTURE-WRITE-SAFETY-APPROVAL-REQUIRED",
    "MG-SH3C-JAVA-SEED-NOT-AUTHORED",
    "MG-SH3C-REQUEST-REVIEW:$.body.batchPkFieldValue",
    "MG-SH3C-REQUEST-REVIEW:$.body.clientSessionId",
    "MG-SH3C-REQUEST-REVIEW:$.body.domain",
    "MG-SH3C-REQUEST-REVIEW:$.body.horizontalId",
    "MG-SH3C-REQUEST-REVIEW:$.body.interId",
    "MG-SH3C-REQUEST-REVIEW:$.body.operationKind",
    "MG-SH3C-REQUEST-REVIEW:$.body.operationLabel",
    "MG-SH3C-REQUEST-REVIEW:$.body.pageId",
    "MG-SH3C-REQUEST-REVIEW:$.body.panelId",
    "MG-SH3C-REQUEST-REVIEW:$.body.reqId",
    "MG-SH3C-REQUEST-REVIEW:$.body.usePageId",
    "MG-SH3C-REQUEST-REVIEW:$.headers.x-tenant-id",
    "MG-SH3C-RUST-SEED-ADAPTER-NOT-BOUND",
    "MG-SH3C-STATE-PROFILE-NOT-APPROVED",
    "MG-SH3C-WEBSOCKET-EVENT-COLLECTOR-NOT-BOUND"
  ],
  "packageHash": "52bb71e1761a319721aad28caa595b8638d69c828fc375b8b453cfc8e3431469"
}
