{
  "schemaVersion": 1,
  "protocol": "migration-guard.batch-update-l4c-scenario-package/v1",
  "status": "review-required",
  "realEvidenceEligible": false,
  "projectId": "zboss-batch-update-with-progress",
  "projectHash": "c31120bc701b3bd350a8ab9af4d543a25610a9923a2601b5298dc71ae5feebcc",
  "runtimeContractHash": "6457fbc0bf6728b0ba03115cc3fb2b920f22cd128d27b8e04157a21336322902",
  "sourceIdentity": {
    "revision": "a95e4cb51ceb62cc07602fe02c3cbb3e45f271ee",
    "dirty": true,
    "dirtyFingerprint": "bffb6682d768b19e32dacea82f5870cfd0acbf74b06051dbbf5da56511df2167",
    "identity": "a95e4cb51ceb62cc07602fe02c3cbb3e45f271ee+dirty:bffb6682d768"
  },
  "promotionWave": "sh3c-remaining-wave",
  "entrypointId": "post-zboss-data-view-dynamic-engine-use-engine-use-batch-page-batchUpdateWithProgress",
  "scenarioId": "batch-update-success",
  "category": "concurrency",
  "requiredDimensions": [
    "http",
    "context",
    "decisions",
    "effects",
    "state",
    "events",
    "failures"
  ],
  "decisionIds": [
    "BUP-DEC-PROGRESS-TERMINAL",
    "BUP-DEC-UNDO-DURABILITY"
  ],
  "sourceDraft": {
    "path": "fixtures/java-runtime-drafts/post-zboss-data-view-dynamic-engine-use-engine-use-batch-page-batchUpdateWithProgress/batch-update-success/fixture.draft.json",
    "sha256": "246228525d6e265198937fb0d90160f12eefbd893aea97dc2dcde3599bfb3bcc"
  },
  "stateProfile": {
    "path": "evidence/runtime/l4c/java-state-profile.template.json",
    "sha256": "cab45568032446da26aaae696c083c6ef61f17ccdb58377091c5e8c09501ca6f",
    "status": "template",
    "applicableScenarios": [
      "primary-success",
      "validation-failure",
      "batch-partial-failure",
      "dependency-failure",
      "concurrent-write"
    ]
  },
  "collectors": {
    "events": {
      "path": "fixtures/java-runtime-drafts/post-zboss-data-view-dynamic-engine-use-engine-use-batch-page-batchUpdateWithProgress/batch-update-success/collectors/events.draft.json",
      "sha256": "02dd8101b82a2df9e90e9d7aa047a040be67d53a25cd7f0b22f56ca99d365f60",
      "status": "draft",
      "reviewFindings": [
        "STATUS-NOT-READY",
        "WEBSOCKET-CAPTURE-NOT-CONFIRMED"
      ]
    },
    "mysql": {
      "path": "fixtures/java-runtime-drafts/post-zboss-data-view-dynamic-engine-use-engine-use-batch-page-batchUpdateWithProgress/batch-update-success/collectors/mysql.draft.json",
      "sha256": "4b213cba2e1345a9ba201c7466614c931ae61af91b23410b34872c13c068cbe1",
      "status": "draft",
      "reviewFindings": [
        "STATUS-NOT-READY",
        "PLACEHOLDER-PROBE"
      ]
    },
    "redis": {
      "path": "fixtures/java-runtime-drafts/post-zboss-data-view-dynamic-engine-use-engine-use-batch-page-batchUpdateWithProgress/batch-update-success/collectors/redis.draft.json",
      "sha256": "f5953888bc6bca7a954a08f4959211cf618e65755e77af32a7f4fb060a7109c8",
      "status": "draft",
      "reviewFindings": [
        "STATUS-NOT-READY",
        "PLACEHOLDER-PROBE",
        "JAVA-PROGRESS-IS-NOT-REDIS-BACKED"
      ]
    }
  },
  "requestPlan": {
    "status": "review-required",
    "placeholderPaths": [
      "$.body.batchPkFieldValue",
      "$.body.clientSessionId",
      "$.body.domain",
      "$.body.horizontalId",
      "$.body.interId",
      "$.body.operationKind",
      "$.body.operationLabel",
      "$.body.pageId",
      "$.body.panelId",
      "$.body.reqId",
      "$.body.usePageId",
      "$.headers.x-tenant-id"
    ],
    "environmentBindings": [
      {
        "path": "request.headers.authorization",
        "environment": "MG_JAVA_TOKEN"
      }
    ]
  },
  "seedPlan": {
    "status": "review-required",
    "plannedRows": 1,
    "java": {
      "status": "seed-required",
      "resourceRole": "projection",
      "binding": "scenario.seedProfiles.source"
    },
    "rust": {
      "status": "adapter-required",
      "resourceRole": "projection",
      "binding": "scenario.seedProfiles.target"
    }
  },
  "componentPreparation": {
    "status": "review-required",
    "path": "evidence/runtime/l4c/scenario-preparation/remaining-wave/components/batch-update-success.json",
    "sha256": "7c39456fb2846a4ddf1e9ab0b752090f8d8ffd4b62398774d4fb0d9e633fb478",
    "seedCandidates": {
      "java": {
        "path": "evidence/runtime/l4c/scenario-preparation/remaining-wave/seeds/batch-update-success.java-seed.template.json",
        "sha256": "b8b7aa55de9c1a3c647032c3d9eb131a87b27b845a04aad630511d608e2eb167",
        "status": "review-required"
      },
      "rust": {
        "path": "evidence/runtime/l4c/scenario-preparation/remaining-wave/seeds/batch-update-success.rust-seed.adapter-template.json",
        "sha256": "7f19f1e884f95b7ec86dc6c0a90802b293eaf1794d36c2b62490c38fc5e25c9f",
        "status": "review-required"
      }
    },
    "collectorCandidates": {
      "events": {
        "path": "evidence/runtime/l4c/scenario-preparation/remaining-wave/collectors/batch-update-success.events.template.json",
        "sha256": "6726dbd152a7e15a5bae909467912fd763bad0b60f783ca710480884ee2b265f",
        "status": "review-required"
      },
      "mysql": {
        "path": "evidence/runtime/l4c/scenario-preparation/remaining-wave/collectors/batch-update-success.mysql.template.json",
        "sha256": "55f2b51fd58bc4b8da02f7d28283768848e0d0ec3f7c8b770d8d3b880a5cf865",
        "status": "review-required"
      },
      "redis": {
        "path": "evidence/runtime/l4c/scenario-preparation/remaining-wave/collectors/batch-update-success.redis.template.json",
        "sha256": "cc4198fa87ddd8a73c5b4deab1bebe35d3a598cb4ba226ffdd3bd3acf7ca46cf",
        "status": "review-required"
      }
    },
    "binding": {
      "path": "evidence/runtime/l4c/scenario-preparation/remaining-wave/binding-preparation.json",
      "status": "review-required",
      "scenarioBindingHash": "1bc50317d1935ae1ec092c3445485e0ba4e733159377a72270bfa8aa8141e175"
    }
  },
  "expectedObservation": {
    "status": "review-required",
    "dimensions": [
      "http",
      "context",
      "decisions",
      "effects",
      "state",
      "events",
      "failures"
    ],
    "invariants": [
      "complete-canonical-observation",
      "source-target-semantic-comparison",
      "marker-bound-cleanup-zero"
    ]
  },
  "semanticIntent": {
    "intent": "remaining-wave-batch-update-success-contract",
    "contractExpectations": {
      "batch": {
        "requireUndoCorrespondence": false,
        "requireProgressTerminal": true,
        "requireSharedLock": false,
        "requireChunkIdempotency": false,
        "requireTransactionTerminalOrdering": true,
        "requireRowLimitContract": false,
        "requireCompleteRowClassification": true,
        "requireReaderWriterLease": false,
        "requireUndoDurability": true,
        "requireProgressTerminalIdentity": true
      }
    }
  },
  "formalPromotion": {
    "command": "migration-guard migrate runtime-fixture-promote --case-dir cases/zboss-batch-update-with-progress --entrypoint post-zboss-data-view-dynamic-engine-use-engine-use-batch-page-batchUpdateWithProgress --scenario batch-update-success --reviewed-by <reviewer>",
    "allowedOnlyWhenBlockersEmpty": true,
    "status": "pending"
  },
  "blockers": [
    "MG-SH3C-COLLECTOR-REVIEW:events:STATUS-NOT-READY",
    "MG-SH3C-COLLECTOR-REVIEW:events:WEBSOCKET-CAPTURE-NOT-CONFIRMED",
    "MG-SH3C-COLLECTOR-REVIEW:mysql:PLACEHOLDER-PROBE",
    "MG-SH3C-COLLECTOR-REVIEW:mysql:STATUS-NOT-READY",
    "MG-SH3C-COLLECTOR-REVIEW:redis:JAVA-PROGRESS-IS-NOT-REDIS-BACKED",
    "MG-SH3C-COLLECTOR-REVIEW:redis:PLACEHOLDER-PROBE",
    "MG-SH3C-COLLECTOR-REVIEW:redis:STATUS-NOT-READY",
    "MG-SH3C-FIXTURE-WRITE-SAFETY-APPROVAL-REQUIRED",
    "MG-SH3C-JAVA-SEED-NOT-AUTHORED",
    "MG-SH3C-REQUEST-REVIEW:$.body.batchPkFieldValue",
    "MG-SH3C-REQUEST-REVIEW:$.body.clientSessionId",
    "MG-SH3C-REQUEST-REVIEW:$.body.domain",
    "MG-SH3C-REQUEST-REVIEW:$.body.horizontalId",
    "MG-SH3C-REQUEST-REVIEW:$.body.interId",
    "MG-SH3C-REQUEST-REVIEW:$.body.operationKind",
    "MG-SH3C-REQUEST-REVIEW:$.body.operationLabel",
    "MG-SH3C-REQUEST-REVIEW:$.body.pageId",
    "MG-SH3C-REQUEST-REVIEW:$.body.panelId",
    "MG-SH3C-REQUEST-REVIEW:$.body.reqId",
    "MG-SH3C-REQUEST-REVIEW:$.body.usePageId",
    "MG-SH3C-REQUEST-REVIEW:$.headers.x-tenant-id",
    "MG-SH3C-RUST-SEED-ADAPTER-NOT-BOUND",
    "MG-SH3C-STATE-PROFILE-NOT-APPROVED",
    "MG-SH3C-WEBSOCKET-EVENT-COLLECTOR-NOT-BOUND"
  ],
  "packageHash": "8c08d5ae80b04f1ad701c39db77fa2647b07b836fc06337079e03d25681c24ad"
}
