{
  "schemaVersion": 1,
  "protocol": "migration-guard.batch-update-l4c-scenario-package/v1",
  "status": "review-required",
  "realEvidenceEligible": false,
  "projectId": "zboss-batch-update-with-progress",
  "projectHash": "c31120bc701b3bd350a8ab9af4d543a25610a9923a2601b5298dc71ae5feebcc",
  "runtimeContractHash": "6457fbc0bf6728b0ba03115cc3fb2b920f22cd128d27b8e04157a21336322902",
  "sourceIdentity": {
    "revision": "a95e4cb51ceb62cc07602fe02c3cbb3e45f271ee",
    "dirty": true,
    "dirtyFingerprint": "bffb6682d768b19e32dacea82f5870cfd0acbf74b06051dbbf5da56511df2167",
    "identity": "a95e4cb51ceb62cc07602fe02c3cbb3e45f271ee+dirty:bffb6682d768"
  },
  "promotionWave": "sh3c-remaining-wave",
  "entrypointId": "post-zboss-data-view-dynamic-engine-use-engine-use-batch-page-batchUpdateWithProgress",
  "scenarioId": "progress-event-shape",
  "category": "success",
  "requiredDimensions": [
    "http",
    "context",
    "decisions",
    "effects",
    "state",
    "events",
    "failures"
  ],
  "decisionIds": [
    "BUP-DEC-PROGRESS-TERMINAL"
  ],
  "sourceDraft": {
    "path": "fixtures/java-runtime-drafts/post-zboss-data-view-dynamic-engine-use-engine-use-batch-page-batchUpdateWithProgress/progress-event-shape/fixture.draft.json",
    "sha256": "991a17615e0f3f31e05a9d3edea2083be4d9084734ce4ee561aad58a13e62b83"
  },
  "stateProfile": {
    "path": "evidence/runtime/l4c/java-state-profile.template.json",
    "sha256": "cab45568032446da26aaae696c083c6ef61f17ccdb58377091c5e8c09501ca6f",
    "status": "template",
    "applicableScenarios": [
      "primary-success",
      "validation-failure",
      "batch-partial-failure",
      "dependency-failure",
      "concurrent-write"
    ]
  },
  "collectors": {
    "events": {
      "path": "fixtures/java-runtime-drafts/post-zboss-data-view-dynamic-engine-use-engine-use-batch-page-batchUpdateWithProgress/progress-event-shape/collectors/events.draft.json",
      "sha256": "b27da188bede41fcc146e5a093b453cd081efda2d45e03565dcea6ebe0116c88",
      "status": "draft",
      "reviewFindings": [
        "STATUS-NOT-READY",
        "WEBSOCKET-CAPTURE-NOT-CONFIRMED"
      ]
    },
    "mysql": {
      "path": "fixtures/java-runtime-drafts/post-zboss-data-view-dynamic-engine-use-engine-use-batch-page-batchUpdateWithProgress/progress-event-shape/collectors/mysql.draft.json",
      "sha256": "4b213cba2e1345a9ba201c7466614c931ae61af91b23410b34872c13c068cbe1",
      "status": "draft",
      "reviewFindings": [
        "STATUS-NOT-READY",
        "PLACEHOLDER-PROBE"
      ]
    },
    "redis": {
      "path": "fixtures/java-runtime-drafts/post-zboss-data-view-dynamic-engine-use-engine-use-batch-page-batchUpdateWithProgress/progress-event-shape/collectors/redis.draft.json",
      "sha256": "f5953888bc6bca7a954a08f4959211cf618e65755e77af32a7f4fb060a7109c8",
      "status": "draft",
      "reviewFindings": [
        "STATUS-NOT-READY",
        "PLACEHOLDER-PROBE",
        "JAVA-PROGRESS-IS-NOT-REDIS-BACKED"
      ]
    }
  },
  "requestPlan": {
    "status": "review-required",
    "placeholderPaths": [
      "$.body.batchPkFieldValue",
      "$.body.clientSessionId",
      "$.body.domain",
      "$.body.horizontalId",
      "$.body.interId",
      "$.body.operationKind",
      "$.body.operationLabel",
      "$.body.pageId",
      "$.body.panelId",
      "$.body.reqId",
      "$.body.usePageId",
      "$.headers.x-tenant-id"
    ],
    "environmentBindings": [
      {
        "path": "request.headers.authorization",
        "environment": "MG_JAVA_TOKEN"
      }
    ]
  },
  "seedPlan": {
    "status": "review-required",
    "plannedRows": 1,
    "java": {
      "status": "seed-required",
      "resourceRole": "projection",
      "binding": "scenario.seedProfiles.source"
    },
    "rust": {
      "status": "adapter-required",
      "resourceRole": "projection",
      "binding": "scenario.seedProfiles.target"
    }
  },
  "componentPreparation": {
    "status": "review-required",
    "path": "evidence/runtime/l4c/scenario-preparation/remaining-wave/components/progress-event-shape.json",
    "sha256": "09fc936e923f8623a967cf8abd9edd3891863ca1f148847655ca11ebdab0ab4d",
    "seedCandidates": {
      "java": {
        "path": "evidence/runtime/l4c/scenario-preparation/remaining-wave/seeds/progress-event-shape.java-seed.template.json",
        "sha256": "960fef55be8d373b35aa57c6aa44b441ee3182e336acd457e5aee04463d6c9a1",
        "status": "review-required"
      },
      "rust": {
        "path": "evidence/runtime/l4c/scenario-preparation/remaining-wave/seeds/progress-event-shape.rust-seed.adapter-template.json",
        "sha256": "942b75a7b00b9ea54fd5f1003998dea87b6674407cd4562e63302b8fe68de4e5",
        "status": "review-required"
      }
    },
    "collectorCandidates": {
      "events": {
        "path": "evidence/runtime/l4c/scenario-preparation/remaining-wave/collectors/progress-event-shape.events.template.json",
        "sha256": "03ff37344d8f8ec6768a32d686f059db42a826e3608744eff510d870a857e372",
        "status": "review-required"
      },
      "mysql": {
        "path": "evidence/runtime/l4c/scenario-preparation/remaining-wave/collectors/progress-event-shape.mysql.template.json",
        "sha256": "13346404024663db77ae41522add9a0279936957709233a995ea9794290dd3e5",
        "status": "review-required"
      },
      "redis": {
        "path": "evidence/runtime/l4c/scenario-preparation/remaining-wave/collectors/progress-event-shape.redis.template.json",
        "sha256": "563e8285ea9883282ed18aca5b1b231ac27679dac22f8efd95a96cd887d39a0a",
        "status": "review-required"
      }
    },
    "binding": {
      "path": "evidence/runtime/l4c/scenario-preparation/remaining-wave/binding-preparation.json",
      "status": "review-required",
      "scenarioBindingHash": "ad7e66e1e5fe8330732f682e3ed0014f0767917a9f3d5229d28b5ca428a9e6a9"
    }
  },
  "expectedObservation": {
    "status": "review-required",
    "dimensions": [
      "http",
      "context",
      "decisions",
      "effects",
      "state",
      "events",
      "failures"
    ],
    "invariants": [
      "complete-canonical-observation",
      "source-target-semantic-comparison",
      "marker-bound-cleanup-zero"
    ]
  },
  "semanticIntent": {
    "intent": "remaining-wave-progress-event-shape-contract",
    "contractExpectations": {
      "batch": {
        "requireUndoCorrespondence": false,
        "requireProgressTerminal": true,
        "requireSharedLock": false,
        "requireChunkIdempotency": false,
        "requireTransactionTerminalOrdering": true,
        "requireRowLimitContract": false,
        "requireCompleteRowClassification": true,
        "requireReaderWriterLease": false,
        "requireUndoDurability": false,
        "requireProgressTerminalIdentity": true
      }
    }
  },
  "formalPromotion": {
    "command": "migration-guard migrate runtime-fixture-promote --case-dir cases/zboss-batch-update-with-progress --entrypoint post-zboss-data-view-dynamic-engine-use-engine-use-batch-page-batchUpdateWithProgress --scenario progress-event-shape --reviewed-by <reviewer>",
    "allowedOnlyWhenBlockersEmpty": true,
    "status": "pending"
  },
  "blockers": [
    "MG-SH3C-COLLECTOR-REVIEW:events:STATUS-NOT-READY",
    "MG-SH3C-COLLECTOR-REVIEW:events:WEBSOCKET-CAPTURE-NOT-CONFIRMED",
    "MG-SH3C-COLLECTOR-REVIEW:mysql:PLACEHOLDER-PROBE",
    "MG-SH3C-COLLECTOR-REVIEW:mysql:STATUS-NOT-READY",
    "MG-SH3C-COLLECTOR-REVIEW:redis:JAVA-PROGRESS-IS-NOT-REDIS-BACKED",
    "MG-SH3C-COLLECTOR-REVIEW:redis:PLACEHOLDER-PROBE",
    "MG-SH3C-COLLECTOR-REVIEW:redis:STATUS-NOT-READY",
    "MG-SH3C-FIXTURE-WRITE-SAFETY-APPROVAL-REQUIRED",
    "MG-SH3C-JAVA-SEED-NOT-AUTHORED",
    "MG-SH3C-REQUEST-REVIEW:$.body.batchPkFieldValue",
    "MG-SH3C-REQUEST-REVIEW:$.body.clientSessionId",
    "MG-SH3C-REQUEST-REVIEW:$.body.domain",
    "MG-SH3C-REQUEST-REVIEW:$.body.horizontalId",
    "MG-SH3C-REQUEST-REVIEW:$.body.interId",
    "MG-SH3C-REQUEST-REVIEW:$.body.operationKind",
    "MG-SH3C-REQUEST-REVIEW:$.body.operationLabel",
    "MG-SH3C-REQUEST-REVIEW:$.body.pageId",
    "MG-SH3C-REQUEST-REVIEW:$.body.panelId",
    "MG-SH3C-REQUEST-REVIEW:$.body.reqId",
    "MG-SH3C-REQUEST-REVIEW:$.body.usePageId",
    "MG-SH3C-REQUEST-REVIEW:$.headers.x-tenant-id",
    "MG-SH3C-RUST-SEED-ADAPTER-NOT-BOUND",
    "MG-SH3C-STATE-PROFILE-NOT-APPROVED",
    "MG-SH3C-WEBSOCKET-EVENT-COLLECTOR-NOT-BOUND"
  ],
  "packageHash": "8bdd8a46b16b5d58ae50587ed89d91e3097e59a51bf7cae3ffba073ce48bd469"
}
