{
  "schemaVersion": 1,
  "protocol": "migration-guard.batch-update-l4c-scenario-package/v1",
  "status": "review-required",
  "realEvidenceEligible": false,
  "projectId": "zboss-batch-update-with-progress",
  "projectHash": "c31120bc701b3bd350a8ab9af4d543a25610a9923a2601b5298dc71ae5feebcc",
  "runtimeContractHash": "6457fbc0bf6728b0ba03115cc3fb2b920f22cd128d27b8e04157a21336322902",
  "sourceIdentity": {
    "revision": "a95e4cb51ceb62cc07602fe02c3cbb3e45f271ee",
    "dirty": true,
    "dirtyFingerprint": "bffb6682d768b19e32dacea82f5870cfd0acbf74b06051dbbf5da56511df2167",
    "identity": "a95e4cb51ceb62cc07602fe02c3cbb3e45f271ee+dirty:bffb6682d768"
  },
  "promotionWave": "sh3c-remaining-wave",
  "entrypointId": "post-zboss-data-view-dynamic-engine-use-engine-use-batch-page-batchUpdateWithProgress",
  "scenarioId": "scale-boundary",
  "category": "scale",
  "requiredDimensions": [
    "http",
    "context",
    "decisions",
    "effects",
    "state",
    "events",
    "failures",
    "performance"
  ],
  "decisionIds": [],
  "sourceDraft": {
    "path": "fixtures/java-runtime-drafts/post-zboss-data-view-dynamic-engine-use-engine-use-batch-page-batchUpdateWithProgress/scale-boundary/fixture.draft.json",
    "sha256": "d29299756ffbce8a361d4b8c44c95f58968e7173f7b87583bf4688850b36559a"
  },
  "stateProfile": {
    "path": "evidence/runtime/l4c/java-state-profile.template.json",
    "sha256": "cab45568032446da26aaae696c083c6ef61f17ccdb58377091c5e8c09501ca6f",
    "status": "template",
    "applicableScenarios": [
      "primary-success",
      "validation-failure",
      "batch-partial-failure",
      "dependency-failure",
      "concurrent-write"
    ]
  },
  "collectors": {
    "events": {
      "path": "fixtures/java-runtime-drafts/post-zboss-data-view-dynamic-engine-use-engine-use-batch-page-batchUpdateWithProgress/scale-boundary/collectors/events.draft.json",
      "sha256": "4c8618666caff7fd3bfc752010ae2a4318d5f41c23b4ed6f32d6549e584aaf99",
      "status": "draft",
      "reviewFindings": [
        "STATUS-NOT-READY",
        "WEBSOCKET-CAPTURE-NOT-CONFIRMED"
      ]
    },
    "mysql": {
      "path": "fixtures/java-runtime-drafts/post-zboss-data-view-dynamic-engine-use-engine-use-batch-page-batchUpdateWithProgress/scale-boundary/collectors/mysql.draft.json",
      "sha256": "4b213cba2e1345a9ba201c7466614c931ae61af91b23410b34872c13c068cbe1",
      "status": "draft",
      "reviewFindings": [
        "STATUS-NOT-READY",
        "PLACEHOLDER-PROBE"
      ]
    },
    "redis": {
      "path": "fixtures/java-runtime-drafts/post-zboss-data-view-dynamic-engine-use-engine-use-batch-page-batchUpdateWithProgress/scale-boundary/collectors/redis.draft.json",
      "sha256": "f5953888bc6bca7a954a08f4959211cf618e65755e77af32a7f4fb060a7109c8",
      "status": "draft",
      "reviewFindings": [
        "STATUS-NOT-READY",
        "PLACEHOLDER-PROBE",
        "JAVA-PROGRESS-IS-NOT-REDIS-BACKED"
      ]
    }
  },
  "requestPlan": {
    "status": "review-required",
    "placeholderPaths": [
      "$.body.batchPkFieldValue",
      "$.body.clientSessionId",
      "$.body.domain",
      "$.body.horizontalId",
      "$.body.interId",
      "$.body.operationKind",
      "$.body.operationLabel",
      "$.body.pageId",
      "$.body.panelId",
      "$.body.reqId",
      "$.body.usePageId",
      "$.headers.x-tenant-id"
    ],
    "environmentBindings": [
      {
        "path": "request.headers.authorization",
        "environment": "MG_JAVA_TOKEN"
      }
    ]
  },
  "seedPlan": {
    "status": "review-required",
    "plannedRows": 1,
    "java": {
      "status": "seed-required",
      "resourceRole": "projection",
      "binding": "scenario.seedProfiles.source"
    },
    "rust": {
      "status": "adapter-required",
      "resourceRole": "projection",
      "binding": "scenario.seedProfiles.target"
    }
  },
  "componentPreparation": {
    "status": "review-required",
    "path": "evidence/runtime/l4c/scenario-preparation/remaining-wave/components/scale-boundary.json",
    "sha256": "35cf07f881e0527a3c7930fb6a3887ad7d8b529fb8392b396d5b325540d45eb4",
    "seedCandidates": {
      "java": {
        "path": "evidence/runtime/l4c/scenario-preparation/remaining-wave/seeds/scale-boundary.java-seed.template.json",
        "sha256": "0bcf6134cc9b25d1faa4d566585f5f3bdae20612a9ecf2169489ce893b5d977c",
        "status": "review-required"
      },
      "rust": {
        "path": "evidence/runtime/l4c/scenario-preparation/remaining-wave/seeds/scale-boundary.rust-seed.adapter-template.json",
        "sha256": "bb12643d634bb4167052c77f4cfb0b2eb802502381a86d8473b91b40cf0e66ee",
        "status": "review-required"
      }
    },
    "collectorCandidates": {
      "events": {
        "path": "evidence/runtime/l4c/scenario-preparation/remaining-wave/collectors/scale-boundary.events.template.json",
        "sha256": "4af8c0a2d9c82e93843f8d9a8f72e29d47beb57df251e96a41d11c1165ac1e78",
        "status": "review-required"
      },
      "mysql": {
        "path": "evidence/runtime/l4c/scenario-preparation/remaining-wave/collectors/scale-boundary.mysql.template.json",
        "sha256": "f7ab2b932661a7e1b7b7e3bd8095be538bbac8b21a04df9be58b89e17f6994e9",
        "status": "review-required"
      },
      "redis": {
        "path": "evidence/runtime/l4c/scenario-preparation/remaining-wave/collectors/scale-boundary.redis.template.json",
        "sha256": "c89cbf0d8709287e765da6b5e6072ca5277f5737b3efdf78916483db6be44f11",
        "status": "review-required"
      }
    },
    "binding": {
      "path": "evidence/runtime/l4c/scenario-preparation/remaining-wave/binding-preparation.json",
      "status": "review-required",
      "scenarioBindingHash": "9bedeeb59704c2befb1491f468131e99b8a57a47fc410521310245f95611e4e1"
    }
  },
  "expectedObservation": {
    "status": "review-required",
    "dimensions": [
      "http",
      "context",
      "decisions",
      "effects",
      "state",
      "events",
      "failures",
      "performance"
    ],
    "invariants": [
      "complete-canonical-observation",
      "source-target-semantic-comparison",
      "marker-bound-cleanup-zero"
    ]
  },
  "semanticIntent": {
    "intent": "remaining-wave-scale-boundary-contract",
    "contractExpectations": {
      "batch": {
        "requireUndoCorrespondence": false,
        "requireProgressTerminal": true,
        "requireSharedLock": false,
        "requireChunkIdempotency": false,
        "requireTransactionTerminalOrdering": true,
        "requireRowLimitContract": false,
        "requireCompleteRowClassification": true,
        "requireReaderWriterLease": false,
        "requireUndoDurability": false,
        "requireProgressTerminalIdentity": false
      }
    }
  },
  "formalPromotion": {
    "command": "migration-guard migrate runtime-fixture-promote --case-dir cases/zboss-batch-update-with-progress --entrypoint post-zboss-data-view-dynamic-engine-use-engine-use-batch-page-batchUpdateWithProgress --scenario scale-boundary --reviewed-by <reviewer>",
    "allowedOnlyWhenBlockersEmpty": true,
    "status": "pending"
  },
  "blockers": [
    "MG-SH3C-COLLECTOR-REVIEW:events:STATUS-NOT-READY",
    "MG-SH3C-COLLECTOR-REVIEW:events:WEBSOCKET-CAPTURE-NOT-CONFIRMED",
    "MG-SH3C-COLLECTOR-REVIEW:mysql:PLACEHOLDER-PROBE",
    "MG-SH3C-COLLECTOR-REVIEW:mysql:STATUS-NOT-READY",
    "MG-SH3C-COLLECTOR-REVIEW:redis:JAVA-PROGRESS-IS-NOT-REDIS-BACKED",
    "MG-SH3C-COLLECTOR-REVIEW:redis:PLACEHOLDER-PROBE",
    "MG-SH3C-COLLECTOR-REVIEW:redis:STATUS-NOT-READY",
    "MG-SH3C-FIXTURE-WRITE-SAFETY-APPROVAL-REQUIRED",
    "MG-SH3C-JAVA-SEED-NOT-AUTHORED",
    "MG-SH3C-REQUEST-REVIEW:$.body.batchPkFieldValue",
    "MG-SH3C-REQUEST-REVIEW:$.body.clientSessionId",
    "MG-SH3C-REQUEST-REVIEW:$.body.domain",
    "MG-SH3C-REQUEST-REVIEW:$.body.horizontalId",
    "MG-SH3C-REQUEST-REVIEW:$.body.interId",
    "MG-SH3C-REQUEST-REVIEW:$.body.operationKind",
    "MG-SH3C-REQUEST-REVIEW:$.body.operationLabel",
    "MG-SH3C-REQUEST-REVIEW:$.body.pageId",
    "MG-SH3C-REQUEST-REVIEW:$.body.panelId",
    "MG-SH3C-REQUEST-REVIEW:$.body.reqId",
    "MG-SH3C-REQUEST-REVIEW:$.body.usePageId",
    "MG-SH3C-REQUEST-REVIEW:$.headers.x-tenant-id",
    "MG-SH3C-RUST-SEED-ADAPTER-NOT-BOUND",
    "MG-SH3C-STATE-PROFILE-NOT-APPROVED",
    "MG-SH3C-WEBSOCKET-EVENT-COLLECTOR-NOT-BOUND"
  ],
  "packageHash": "fb12ba3d7ccb186afe6ccd3ea567e44351cd46405db9aa6b969de4b1a518839c"
}
